<?xml version="1.0" encoding="UTF-8"?>
<!--DTD generated by XMLSPY v2004 rel. 3 U (http://www.xmlspy.com)-->
<!ELEMENT applications (app+)>
<!ELEMENT app EMPTY>
<!ATTLIST app
	id CDATA #REQUIRED
	caption CDATA #REQUIRED
	title CDATA #REQUIRED
	icon CDATA #REQUIRED
>
